{
  "subject_id": "ap-psychology",
  "subject_name": "AP Psychology",
  "exam_date": "2026-05-05",
  "total_mcq_count": 100,
  "units": [
    {
      "unit_id": "unit-1",
      "unit_name": "Biological Bases of Behavior",
      "unit_number": 1,
      "college_board_percentage": 9,
      "learning_objectives": ["PSY-1.A", "PSY-1.B", "PSY-1.C", "PSY-1.D"]
    },
    {
      "unit_id": "unit-2",
      "unit_name": "Sensation and Perception",
      "unit_number": 2,
      "college_board_percentage": 7,
      "learning_objectives": ["PSY-2.A", "PSY-2.B", "PSY-2.C", "PSY-2.D"]
    },
    {
      "unit_id": "unit-3",
      "unit_name": "Learning",
      "unit_number": 3,
      "college_board_percentage": 8,
      "learning_objectives": ["PSY-3.A", "PSY-3.B", "PSY-3.C", "PSY-3.D"]
    },
    {
      "unit_id": "unit-4",
      "unit_name": "Cognitive Psychology",
      "unit_number": 4,
      "college_board_percentage": 14,
      "learning_objectives": ["PSY-4.A", "PSY-4.B", "PSY-4.C", "PSY-4.D", "PSY-4.E"]
    },
    {
      "unit_id": "unit-5",
      "unit_name": "Developmental Psychology",
      "unit_number": 5,
      "college_board_percentage": 8,
      "learning_objectives": ["PSY-5.A", "PSY-5.B", "PSY-5.C", "PSY-5.D"]
    },
    {
      "unit_id": "unit-6",
      "unit_name": "Testing and Individual Differences",
      "unit_number": 6,
      "college_board_percentage": 6,
      "learning_objectives": ["PSY-6.A", "PSY-6.B", "PSY-6.C"]
    },
    {
      "unit_id": "unit-7",
      "unit_name": "Motivation, Emotion, and Personality",
      "unit_number": 7,
      "college_board_percentage": 13,
      "learning_objectives": ["PSY-7.A", "PSY-7.B", "PSY-7.C", "PSY-7.D", "PSY-7.E"]
    },
    {
      "unit_id": "unit-8",
      "unit_name": "Clinical Psychology",
      "unit_number": 8,
      "college_board_percentage": 14,
      "learning_objectives": ["PSY-8.A", "PSY-8.B", "PSY-8.C", "PSY-8.D"]
    }
  ]
}
