{
  "subject_id": "ap-csp",
  "subject_name": "AP Computer Science Principles",
  "exam_date": "2026-05-14",
  "total_mcq_count": 70,
  "units": [
    {
      "unit_id": "unit-1",
      "unit_name": "Creative Development",
      "unit_number": 1,
      "college_board_percentage": 12,
      "learning_objectives": [
        "CRD-1.A", "CRD-1.B", "CRD-1.C",
        "CRD-2.A", "CRD-2.B", "CRD-2.C", "CRD-2.D", "CRD-2.E",
        "CRD-2.F", "CRD-2.G", "CRD-2.H", "CRD-2.I", "CRD-2.J"
      ]
    },
    {
      "unit_id": "unit-2",
      "unit_name": "Data",
      "unit_number": 2,
      "college_board_percentage": 20,
      "learning_objectives": [
        "DAT-1.A", "DAT-1.B", "DAT-1.C",
        "DAT-2.A", "DAT-2.B", "DAT-2.C", "DAT-2.D", "DAT-2.E"
      ]
    },
    {
      "unit_id": "unit-3",
      "unit_name": "Algorithms and Programming",
      "unit_number": 3,
      "college_board_percentage": 32,
      "learning_objectives": [
        "AAP-1.A", "AAP-1.B", "AAP-1.C", "AAP-1.D",
        "AAP-2.A", "AAP-2.B", "AAP-2.C", "AAP-2.D", "AAP-2.E", "AAP-2.F",
        "AAP-2.G", "AAP-2.H", "AAP-2.I", "AAP-2.J", "AAP-2.K", "AAP-2.L",
        "AAP-2.M", "AAP-2.N", "AAP-2.O", "AAP-2.P",
        "AAP-3.A", "AAP-3.B", "AAP-3.C", "AAP-3.D", "AAP-3.E", "AAP-3.F",
        "AAP-4.A", "AAP-4.B"
      ]
    },
    {
      "unit_id": "unit-4",
      "unit_name": "Computer Systems and Networks",
      "unit_number": 4,
      "college_board_percentage": 13,
      "learning_objectives": [
        "CSN-1.A", "CSN-1.B", "CSN-1.C", "CSN-1.D", "CSN-1.E",
        "CSN-2.A", "CSN-2.B"
      ]
    },
    {
      "unit_id": "unit-5",
      "unit_name": "Impact of Computing",
      "unit_number": 5,
      "college_board_percentage": 23,
      "learning_objectives": [
        "IOC-1.A", "IOC-1.B", "IOC-1.C", "IOC-1.D", "IOC-1.E", "IOC-1.F",
        "IOC-2.A", "IOC-2.B", "IOC-2.C"
      ]
    }
  ]
}
