{
  "subject_id": "ap-comparative-government",
  "subject_name": "AP Comp Gov",
  "exam_date": "2026-05-05",
  "total_mcq_count": 55,
  "units": [
    {
      "unit_id": "unit-1",
      "unit_name": "Political Systems, Regimes, and Governments",
      "unit_number": 1,
      "college_board_percentage": 22,
      "learning_objectives": [
        "MPA-1.A",
        "PAU-1.A", "PAU-1.B", "PAU-1.C", "PAU-1.D",
        "PAU-2.A",
        "LEG-1.A", "LEG-1.B", "LEG-1.C"
      ]
    },
    {
      "unit_id": "unit-2",
      "unit_name": "Political Institutions",
      "unit_number": 2,
      "college_board_percentage": 27,
      "learning_objectives": [
        "PAU-3.A", "PAU-3.B", "PAU-3.C", "PAU-3.D",
        "PAU-3.E", "PAU-3.F", "PAU-3.G", "PAU-3.H"
      ]
    },
    {
      "unit_id": "unit-3",
      "unit_name": "Political Culture and Participation",
      "unit_number": 3,
      "college_board_percentage": 14,
      "learning_objectives": [
        "IEF-1.A", "IEF-1.B", "IEF-1.C", "IEF-1.D",
        "DEM-1.A", "DEM-1.B", "DEM-1.C",
        "LEG-2.A", "LEG-2.B"
      ]
    },
    {
      "unit_id": "unit-4",
      "unit_name": "Party and Electoral Systems and Citizen Organizations",
      "unit_number": 4,
      "college_board_percentage": 15,
      "learning_objectives": [
        "DEM-2.A", "DEM-2.B",
        "PAU-4.A", "PAU-4.B",
        "IEF-2.A", "IEF-2.B"
      ]
    },
    {
      "unit_id": "unit-5",
      "unit_name": "Political and Economic Changes and Development",
      "unit_number": 5,
      "college_board_percentage": 20,
      "learning_objectives": [
        "IEF-3.A", "IEF-3.B", "IEF-3.C", "IEF-3.D", "IEF-3.E",
        "LEG-3.A", "LEG-3.B", "LEG-3.C",
        "LEG-4.A",
        "LEG-5.A"
      ]
    }
  ]
}
